index,genres,title
0,Action Adventure Fantasy Science Fiction,Avatar
1,Adventure Fantasy Action,Pirates of the Caribbean: At World's End
2,Action Adventure Crime,Spectre
3,Action Crime Drama Thriller,The Dark Knight Rises
4,Action Adventure Science Fiction,John Carter
5,Fantasy Action Adventure,Spider-Man 3
6,Animation Family,Tangled
7,Action Adventure Science Fiction,Avengers: Age of Ultron
8,Adventure Fantasy Family,Harry Potter and the Half-Blood Prince
9,Action Adventure Fantasy,Batman v Superman: Dawn of Justice
10,Adventure Fantasy Action Science Fiction,Superman Returns
11,Adventure Action Thriller Crime,Quantum of Solace
12,Adventure Fantasy Action,Pirates of the Caribbean: Dead Man's Chest
13,Action Adventure Western,The Lone Ranger
14,Action Adventure Fantasy Science Fiction,Man of Steel
15,Adventure Family Fantasy,The Chronicles of Narnia: Prince Caspian
16,Science Fiction Action Adventure,The Avengers
17,Adventure Action Fantasy,Pirates of the Caribbean: On Stranger Tides
18,Action Comedy Science Fiction,Men in Black 3
19,Action Adventure Fantasy,The Hobbit: The Battle of the Five Armies
20,Action Adventure Fantasy,The Amazing Spider-Man
21,Action Adventure,Robin Hood
22,Adventure Fantasy,The Hobbit: The Desolation of Smaug
23,Adventure Fantasy,The Golden Compass
24,Adventure Drama Action,King Kong
25,Drama Romance Thriller,Titanic
26,Adventure Action Science Fiction,Captain America: Civil War
27,Thriller Action Adventure Science Fiction,Battleship
28,Action Adventure Science Fiction Thriller,Jurassic World
29,Action Adventure Thriller,Skyfall
30,Action Adventure Fantasy,Spider-Man 2
31,Action Adventure Science Fiction,Iron Man 3
32,Family Fantasy Adventure,Alice in Wonderland
33,Adventure Action Science Fiction Thriller,X-Men: The Last Stand
34,Animation Family,Monsters University
35,Science Fiction Action Adventure,Transformers: Revenge of the Fallen
36,Science Fiction Action Adventure,Transformers: Age of Extinction
37,Fantasy Adventure Family,Oz: The Great and Powerful
38,Action Adventure Fantasy,The Amazing Spider-Man 2
39,Adventure Action Science Fiction,TRON: Legacy
40,Animation Family Adventure Comedy,Cars 2
41,Adventure Action Thriller Science Fiction,Green Lantern
42,Animation Family Comedy,Toy Story 3
43,Action Science Fiction Thriller,Terminator Salvation
44,Action,Furious 7
45,Action Drama Horror Science Fiction Thriller,World War Z
46,Action Adventure Fantasy Science Fiction,X-Men: Days of Future Past
47,Action Adventure Science Fiction,Star Trek Into Darkness
48,Action Family Fantasy,Jack the Giant Slayer
49,Drama Romance,The Great Gatsby
50,Adventure Fantasy Action Romance,Prince of Persia: The Sands of Time
51,Action Science Fiction Adventure,Pacific Rim
52,Action Science Fiction Adventure,Transformers: Dark of the Moon
53,Adventure Action,Indiana Jones and the Kingdom of the Crystal Skull
54,Adventure Animation Family,The Good Dinosaur
55,Animation Adventure Comedy Family Action,Brave
56,Action Adventure Science Fiction,Star Trek Beyond
57,Animation Family,WALL·E
58,Action Comedy Crime Thriller,Rush Hour 3
59,Animation Drama,A Christmas Carol
60,Science Fiction Fantasy Action Adventure,Jupiter Ascending
61,Action Adventure,The Legend of Tarzan
62,Adventure Family Fantasy,"The Chronicles of Narnia: The Lion, the Witch and the Wardrobe"
63,Science Fiction,X-Men: Apocalypse
64,Drama Action Crime Thriller,The Dark Knight
65,Animation Comedy Family Adventure,Up
66,Animation Family Adventure Science Fiction,Monsters vs Aliens
67,Action Science Fiction Adventure,Iron Man
68,Adventure Drama Family,Hugo
69,Action Adventure Comedy Science Fiction Western,Wild Wild West
70,Adventure Action Fantasy,The Mummy: Tomb of the Dragon Emperor
71,Action Adventure Crime Fantasy Science Fiction,Suicide Squad
72,Fantasy Comedy Family,Evan Almighty
73,Action Science Fiction,Edge of Tomorrow
74,Adventure Action,Waterworld
75,Adventure Action Thriller Science Fiction,G.I. Joe: The Rise of Cobra
76,Drama Comedy Animation Family,Inside Out
77,Family Adventure Drama Fantasy,The Jungle Book
78,Adventure Action Science Fiction,Iron Man 2
79,Adventure Fantasy Drama,Snow White and the Huntsman
80,Fantasy Adventure Action Family Romance,Maleficent
81,Science Fiction Action Drama Thriller,Dawn of the Planet of the Apes
82,Action Adventure Science Fiction Romance,The Lovers
83,Drama Action Adventure Fantasy,47 Ronin
84,Action Adventure Science Fiction,Captain America: The Winter Soldier
85,Comedy Adventure Fantasy Animation Family,Shrek Forever After
86,Adventure Family Mystery Science Fiction,Tomorrowland
87,Adventure Family Animation Action Comedy,Big Hero 6
88,Family Animation Comedy Adventure,Wreck-It Ralph
89,Adventure Animation Family Fantasy,The Polar Express
90,Action Adventure Science Fiction,Independence Day: Resurgence
91,Fantasy Adventure Animation Family,How to Train Your Dragon
92,Action Thriller Science Fiction,Terminator 3: Rise of the Machines
93,Action Science Fiction Adventure,Guardians of the Galaxy
94,Adventure Drama Science Fiction,Interstellar
95,Action Thriller Science Fiction Mystery Adventure,Inception
96,Adventure Fantasy Action,The Hobbit: An Unexpected Journey
97,Action Crime Thriller,The Fast and the Furious
98,Fantasy Drama Thriller Mystery Romance,The Curious Case of Benjamin Button
99,Action Science Fiction Adventure,X-Men: First Class
100,Action Adventure Science Fiction,The Hunger Games: Mockingjay - Part 2
101,Fantasy Adventure Action Comedy Drama,The Sorcerer's Apprentice
102,Adventure Action Drama Thriller,Poseidon
103,Fantasy,Alice Through the Looking Glass
104,Fantasy Adventure Animation Comedy Family,Shrek the Third
105,Action Adventure Fantasy,Warcraft
106,Science Fiction Action Thriller Adventure,Terminator Genisys
107,Adventure Family Fantasy,The Chronicles of Narnia: The Voyage of the Dawn Treader
108,History Romance War,Pearl Harbor
109,Adventure Science Fiction Action,Transformers
110,War History Action Adventure Drama,Alexander
111,Adventure Fantasy Family Mystery,Harry Potter and the Order of the Phoenix
112,Adventure Fantasy Family,Harry Potter and the Goblet of Fire
113,Fantasy Action,Hancock
114,Drama Horror Action Thriller Science Fiction,I Am Legend
115,Adventure Comedy Family Fantasy,Charlie and the Chocolate Factory
116,Animation Comedy Family Fantasy,Ratatouille
117,Action Crime Drama,Batman Begins
118,Family Animation,Madagascar: Escape 2 Africa
119,Adventure Fantasy Action Comedy Family,Night at the Museum: Battle of the Smithsonian
120,Adventure Action Thriller Science Fiction,X-Men Origins: Wolverine
121,Adventure Action Thriller Science Fiction,The Matrix Revolutions
122,Animation Adventure Family,Frozen
123,Adventure Action Thriller Science Fiction,The Matrix Reloaded
124,Action Adventure Fantasy,Thor: The Dark World
125,Action Adventure Science Fiction Thriller,Mad Max: Fury Road
126,Thriller Mystery,Angels & Demons
127,Adventure Fantasy Action,Thor
128,Animation Family Adventure Comedy,Bolt
129,Fantasy Action Adventure Family Comedy,G-Force
130,Adventure,Wrath of the Titans
131,Comedy Fantasy,Dark Shadows
132,Action Adventure Thriller,Mission: Impossible - Rogue Nation
133,Drama Horror Thriller,The Wolfman
134,Family Animation Adventure Comedy,Bee Movie
135,Animation Family,Kung Fu Panda 2
136,Action Adventure Family Fantasy,The Last Airbender
137,Adventure Action Thriller,Mission: Impossible III
138,Action Drama Thriller,White House Down
139,Adventure Animation Family,Mars Needs Moms
140,Adventure Animation Comedy Family,Flushed Away
141,Adventure Family Fantasy,Pan
142,Animation Adventure Family,Mr. Peabody & Sherman
143,Adventure Drama War,Troy
144,Animation Family,Madagascar 3: Europe's Most Wanted
145,Adventure Action Thriller,Die Another Day
146,Action Fantasy Comedy,Ghostbusters
147,Action Thriller Science Fiction Adventure,Armageddon
148,Action Adventure Comedy Science Fiction,Men in Black II
149,Adventure Action Animation,Beowulf
150,Action Adventure Animation Comedy Family,Kung Fu Panda 3
151,Action Thriller Adventure,Mission: Impossible - Ghost Protocol
152,Fantasy Animation Family,Rise of the Guardians
153,Comedy,Fun with Dick and Jane
154,Drama Action War History,The Last Samurai
155,Adventure Drama Action,Exodus: Gods and Kings
156,Science Fiction Action Adventure,Star Trek
157,Fantasy Action,Spider-Man
158,Fantasy Action Adventure Animation Comedy,How to Train Your Dragon 2
159,Fantasy,Gods of Egypt
160,Action,Stealth
161,Action Mystery Science Fiction,Watchmen
162,Action Adventure Comedy Crime Thriller,Lethal Weapon 4
163,Drama Action Science Fiction,Hulk
164,Adventure Action Science Fiction Thriller,G.I. Joe: Retaliation
165,Action Adventure Comedy Drama Mystery,Sahara
166,Adventure Action Animation Fantasy Science Fiction,Final Fantasy: The Spirits Within
167,Action Adventure Science Fiction,Captain America: The First Avenger
168,Adventure Action Thriller,The World Is Not Enough
169,Adventure,Master and Commander: The Far Side of the World
170,Adventure Fantasy Drama Romance,The Twilight Saga: Breaking Dawn - Part 2
171,Animation Comedy Family,Happy Feet Two
172,Science Fiction Action Adventure,The Incredible Hulk
173,Adventure Family Fantasy,The BFG
174,Western Drama Adventure Thriller,The Revenant
175,Animation Family,Turbo
176,Animation Comedy Family Western Adventure,Rango
177,Family Animation Adventure Comedy,Penguins of Madagascar
178,Action Drama Mystery Thriller,The Bourne Ultimatum
179,Adventure Animation Family Comedy,Kung Fu Panda
180,Science Fiction Action Adventure,Ant-Man
181,Adventure Action Science Fiction,The Hunger Games: Catching Fire
182,Fantasy Comedy Animation Science Fiction Family,Home
183,Adventure Thriller Science Fiction,War of the Worlds
184,Adventure Action Comedy Thriller Crime,Bad Boys II
185,Action Adventure Animation Family Fantasy,Puss in Boots
186,Action Mystery Thriller,Salt
187,Drama Adventure,Noah
188,Adventure Animation Mystery,The Adventures of Tintin
189,Adventure Fantasy Family,Harry Potter and the Prisoner of Azkaban
190,Drama,Australia
191,Science Fiction Action Adventure,After Earth
192,Animation Family,Dinosaur
193,Adventure Comedy Fantasy Family,Night at the Museum: Secret of the Tomb
194,Animation Action Comedy Family Science Fiction,Megamind
195,Adventure Fantasy Family,Harry Potter and the Philosopher's Stone
196,Fantasy Action Comedy Crime,R.I.P.D.
197,Adventure Fantasy Action,Pirates of the Caribbean: The Curse of the Black Pearl
198,Science Fiction Adventure Thriller,The Hunger Games: Mockingjay - Part 1
199,Thriller Mystery,The Da Vinci Code
200,Animation Adventure Comedy Family,Rio 2
201,Adventure Action Science Fiction Thriller,X2
202,Action Thriller Crime,Fast Five
203,Adventure Action Crime Mystery,Sherlock Holmes: A Game of Shadows
204,Adventure Fantasy Action,Clash of the Titans
205,Action Adventure Science Fiction,Total Recall
206,Adventure Fantasy Action,The 13th Warrior
207,Action Thriller,The Bourne Legacy
208,Action Crime Fantasy,Batman & Robin
209,Family Comedy Fantasy,How the Grinch Stole Christmas
210,Action Adventure Science Fiction Thriller,The Day After Tomorrow
211,Adventure Action Thriller,Mission: Impossible II
212,Drama,The Perfect Storm
213,Adventure Fantasy Action Thriller,4: Rise of the Silver Surfer
214,Adventure Drama Action,Life of Pi
215,Thriller Action Fantasy Horror,Ghost Rider
216,Action Thriller,Jason Bourne
217,Action Adventure Comedy,Charlie's Angels: Full Throttle
218,Science Fiction Adventure Mystery,Prometheus
219,Family Adventure Animation Comedy,Stuart Little 2
220,Science Fiction Action Drama Thriller,Elysium
221,Action Science Fiction,The Chronicles of Riddick
222,Action Science Fiction,RoboCop
223,Action Family Science Fiction,Speed Racer
224,Comedy Drama Romance,How Do You Know
225,Action Comedy,Knight and Day
226,Action Science Fiction Adventure Mystery,Oblivion
227,Science Fiction Adventure Action,Star Wars: Episode III - Revenge of the Sith
228,Adventure Action Science Fiction,Star Wars: Episode II - Attack of the Clones
229,Animation Comedy Family,"Monsters, Inc."
230,Action Science Fiction Adventure Fantasy,The Wolverine
231,Adventure Action Science Fiction,Star Wars: Episode I - The Phantom Menace
232,Adventure Animation Comedy Family Fantasy,The Croods
233,Drama Action History War,Windtalkers
234,Action Adventure Drama,The Huntsman: Winter's War
235,Science Fiction Action Adventure Fantasy Comedy,Teenage Mutant Ninja Turtles
236,Science Fiction Thriller Drama,Gravity
237,Action Adventure Thriller,Dante's Peak
238,Fantasy Action Adventure Comedy,Teenage Mutant Ninja Turtles: Out of the Shadows
239,Action Adventure Science Fiction,Fantastic Four
240,Action Adventure Comedy Family Fantasy,Night at the Museum
241,Action Drama Thriller,San Andreas
242,Adventure Action Thriller,Tomorrow Never Dies
243,Drama History War Action,The Patriot
244,Thriller Crime,Ocean's Twelve
245,Action Comedy Drama Thriller,Mr. & Mrs. Smith
246,Adventure Science Fiction Thriller,Insurgent
247,Drama,The Aviator
248,Comedy,Gulliver's Travels
249,Action Crime Comedy,The Green Hornet
250,Action War,300: Rise of an Empire
251,Animation Family Adventure Comedy Fantasy,The Smurfs
252,Animation Family,Home on the Range
253,Adventure Science Fiction,Allegiant
254,Action Science Fiction Drama,Real Steel
255,Fantasy Family Comedy Animation,The Smurfs 2
256,Action Adventure Thriller,Speed 2: Cruise Control
257,Science Fiction Action Adventure,Ender's Game
258,Action Thriller,Live Free or Die Hard
259,Adventure Fantasy Action,The Lord of the Rings: The Fellowship of the Ring
260,Action Adventure Comedy,Around the World in 80 Days
261,Drama,Ali
262,Comedy Fantasy Family,The Cat in the Hat
263,Action Science Fiction,"I, Robot"
264,Drama Action Adventure History War,Kingdom of Heaven
265,Animation Fantasy Family Comedy,Stuart Little
266,Romance Family Animation Music,The Princess and the Frog
267,Drama Adventure Science Fiction,The Martian
268,Action Thriller Science Fiction Adventure,The Island
269,Comedy Romance,Town & Country
270,Action Crime Thriller,Gone in Sixty Seconds
271,Action Drama Adventure,Gladiator
272,Action Thriller Science Fiction Mystery,Minority Report
273,Adventure Fantasy Family,Harry Potter and the Chamber of Secrets
274,Adventure Action Thriller,Casino Royale
275,Thriller Science Fiction Action Adventure,Planet of the Apes
276,Action Thriller Science Fiction,Terminator 2: Judgment Day
277,History Crime Drama,Public Enemies
278,Drama Crime,American Gangster
279,Action Thriller,True Lies
280,Thriller Drama Crime,The Taking of Pelham 1 2 3
281,Comedy Romance,Little Fockers
282,Action Comedy Crime,The Other Guys
283,Action Drama Mystery Thriller,Eraser
284,Drama Western,Django Unchained
285,Drama Animation Family,The Hunchback of Notre Dame
286,Adventure Animation Comedy Family Fantasy,The Emperor's New Groove
287,Action Adventure Thriller,The Expendables 2
288,Adventure Action Thriller Mystery,National Treasure
289,Fantasy Action Adventure Family,Eragon
290,Family Fantasy,Where the Wild Things Are
291,Animation Adventure Family Fantasy,Epic
292,Action Thriller Romance,The Tourist
293,Action Fantasy Horror Mystery,End of Days
294,Drama Thriller Action,Blood Diamond
295,Crime Drama Comedy,The Wolf of Wall Street
296,Action Crime Fantasy,Batman Forever
297,Adventure Action Thriller Science Fiction,Starship Troopers
298,Drama Science Fiction,Cloud Atlas
299,Animation Adventure Family Fantasy,Legend of the Guardians: The Owls of Ga'Hoole
300,Action Crime,Catwoman
301,Action Adventure,Hercules
302,Adventure Animation Family Fantasy Science Fiction,Treasure Planet
303,Adventure Comedy Science Fiction,Land of the Lost
304,Action Adventure Thriller,The Expendables 3
305,Action Crime Thriller,Point Break
306,Fantasy Comedy Family Adventure,Son of the Mask
307,Thriller Drama Adventure Action History,In the Heart of the Sea
308,Action Comedy Science Fiction,The Adventures of Pluto Nash
309,War Action Adventure Drama Thriller,Green Zone
310,Animation,The Peanuts Movie
311,Crime Drama Mystery Thriller,The Spanish Prisoner
312,Adventure Action Fantasy,The Mummy Returns
313,Drama History Crime,Gangs of New York
314,Animation Comedy Family,Surf's Up
315,Action Comedy Science Fiction,The Stepford Wives
316,Action History War,Black Hawk Down
317,Comedy,The Campaign
318,Adventure Fantasy Action Thriller Science Fiction,The Fifth Element
319,Comedy Drama Romance,Sex and the City 2
320,Adventure Animation Comedy Family,The Road to El Dorado
321,Animation Comedy Adventure Family,Ice Age: Continental Drift
322,Romance Fantasy Family Drama,Cinderella
323,Fantasy Drama,The Lovely Bones
324,Animation Family,Finding Nemo
325,Adventure Fantasy Action,The Lord of the Rings: The Return of the King
326,Adventure Fantasy Action,The Lord of the Rings: The Two Towers
327,Adventure Fantasy,Seventh Son
328,Adventure Fantasy Action Thriller,Lara Croft: Tomb Raider
329,Thriller Science Fiction Drama Mystery,Transcendence
330,Adventure Action Thriller Science Fiction,Jurassic Park III
331,Thriller Action Drama Science Fiction,Rise of the Planet of the Apes
332,Adventure Family Fantasy,The Spiderwick Chronicles
333,Action Thriller,A Good Day to Die Hard
334,Western History War,The Alamo
335,Action Adventure Animation Family,The Incredibles
336,Action Adventure,Cutthroat Island
337,Adventure Fantasy Family,Percy Jackson & the Olympians: The Lightning Thief
338,Action Adventure Comedy Science Fiction,Men in Black
339,Animation Comedy Family,Toy Story 2
340,Action Thriller,Unstoppable
341,Action Comedy Crime Thriller,Rush Hour 2
342,Drama Horror Mystery Thriller,What Lies Beneath
343,Animation Comedy Family,Cloudy with a Chance of Meatballs
344,Animation Comedy Family Adventure,Ice Age: Dawn of the Dinosaurs
345,Adventure Comedy Drama Fantasy,The Secret Life of Walter Mitty
346,Action Adventure Comedy Crime Thriller,Charlie's Angels
347,Drama Thriller Crime,The Departed
348,Animation Family Adventure,Mulan
349,Action Comedy,Tropic Thunder
350,Thriller Crime Mystery Drama,The Girl with the Dragon Tattoo
351,Action Thriller,Die Hard: With a Vengeance
352,Action Adventure Crime Mystery,Sherlock Holmes
353,Drama,Ben-Hur
354,Animation Family Adventure Science Fiction,Atlantis: The Lost Empire
355,Adventure Animation Comedy Family,Alvin and the Chipmunks: The Road Chip
356,Drama Thriller History War,Valkyrie
357,Comedy Action,You Don't Mess with the Zohan
358,Action Comedy Science Fiction,Pixels
359,Drama Science Fiction Adventure,A.I. Artificial Intelligence
360,Thriller Fantasy Comedy Family Mystery,The Haunted Mansion
361,Drama Science Fiction Mystery,Contact
362,Action Science Fiction Thriller,Hollow Man
363,Crime Thriller,The Interpreter
364,Adventure Family Fantasy,Percy Jackson: Sea of Monsters
365,Action Adventure Fantasy Thriller,Lara Croft Tomb Raider: The Cradle of Life
366,Action Adventure Comedy Crime Mystery,Now You See Me 2
367,Thriller Action Romance Science Fiction Adventure,The Saint
368,Action Crime Thriller,Spy Game
369,Science Fiction,Mission to Mars
370,Animation Adventure Comedy Family,Rio
371,Comedy Science Fiction,Bicentennial Man
372,Science Fiction Action Drama Thriller,Volcano
373,Crime Thriller Drama,The Devil's Own
374,Drama History Thriller,K-19: The Widowmaker
375,Adventure Fantasy Action,Conan the Barbarian
376,Romance Drama History,Cinderella Man
377,Fantasy Action Family,The Nutcracker: The Untold Story
378,Drama History,Seabiscuit
379,Action Adventure Drama,Twister
380,Adventure Drama,Cast Away
381,Animation Comedy,Happy Feet
382,Action Drama Thriller,The Bourne Supremacy
383,Action Thriller,Air Force One
384,Thriller Crime,Ocean's Eleven
385,Adventure Action Thriller,The Three Musketeers
386,Animation Comedy Family Fantasy,Hotel Transylvania
387,Comedy Family Fantasy Romance,Enchanted
388,Action Thriller,Safe House
389,Comedy Family,102 Dalmatians
390,Action Comedy,Tower Heist
391,Comedy Romance,The Holiday
392,Action Drama Thriller,Enemy of the State
393,Comedy Romance,It's Complicated
394,Crime Thriller,Ocean's Thirteen
395,Adventure Animation Family,Open Season
396,Adventure Action Science Fiction,Divergent
397,War,Enemy at the Gates
398,Adventure Action Comedy Thriller,The Rundown
399,Adventure Fantasy Action Comedy Family,Last Action Hero
400,Drama History Romance,Memoirs of a Geisha
401,Action Crime Drama Thriller,The Fast and the Furious: Tokyo Drift
402,Drama Animation Family Comedy,Arthur Christmas
403,Fantasy Drama Mystery,Meet Joe Black
404,Action Thriller Drama,Collateral Damage
405,Drama Music,All That Jazz
406,Adventure Fantasy Drama Comedy Science Fiction,Mirror Mirror
407,Action Adventure Comedy,Scott Pilgrim vs. the World
408,Action Thriller Adventure Science Fiction,The Core
409,Fantasy Comedy Romance Science Fiction,Nutty Professor II: The Klumps
410,Mystery Adventure Comedy,Scooby-Doo
411,Action Science Fiction,Dredd
412,Comedy Drama Fantasy Romance,Click
413,Horror Comedy Fantasy,Creepshow
414,Comedy Family,Cats & Dogs 2 : The Revenge of Kitty Galore
415,Adventure Fantasy Science Fiction,Jumper
416,Adventure Fantasy Science Fiction,Hellboy II: The Golden Army
417,Crime Drama Mystery Thriller,Zodiac
418,Science Fiction,The 6th Day
419,Fantasy Comedy,Bruce Almighty
420,Thriller Adventure Action,The Expendables
421,Adventure Action Thriller,Mission: Impossible
422,Science Fiction Adventure Fantasy,The Hunger Games
423,Comedy,The Hangover Part II
424,Action Fantasy,Batman Returns
425,Comedy Animation Family,Over the Hedge
426,Animation Family,Lilo & Stitch
427,Comedy Family Fantasy,Charlotte's Web
428,Action Drama Romance,Deep Impact
429,Action Comedy Crime Thriller,RED 2
430,Comedy Drama,The Longest Yard
431,Comedy Fantasy Family Music Animation,Alvin and the Chipmunks: Chipwrecked
432,Comedy,Grown Ups 2
433,Action Comedy Thriller,Get Smart
434,Drama Comedy Romance,Something's Gotta Give
435,Drama Thriller Mystery,Shutter Island
436,Comedy Romance Drama,Four Christmases
437,Animation Comedy Family Science Fiction,Robots
438,Action Crime Science Fiction Thriller,Face/Off
439,Fantasy Comedy Family Romance,Bedtime Stories
440,Thriller Crime Drama,Road to Perdition
441,Romance Comedy,Just Go with It
442,Action Thriller Crime,Con Air
443,Mystery Thriller Action,Eagle Eye
444,Drama,Cold Mountain
445,Action Thriller Science Fiction,The Book of Eli
446,Comedy Family Science Fiction,Flubber
447,Horror Thriller Fantasy Mystery,The Haunting
448,Animation Comedy Drama Family Fantasy,Space Jam
449,Action Comedy Crime Mystery Family,The Pink Panther
450,Drama Science Fiction Thriller,The Day the Earth Stood Still
451,Action Drama Mystery Thriller,Conspiracy Theory
452,War Drama Action,Fury
453,Action Adventure Comedy Romance,Six Days Seven Nights
454,Comedy Family Animation Adventure,Yogi Bear
455,Western Animation Adventure Comedy Family,Spirit: Stallion of the Cimarron
456,Comedy Romance Family,Zookeeper
457,Adventure Family Science Fiction,Lost in Space
458,Drama Thriller Mystery,The Manchurian Candidate
459,Animation Comedy Family,Hotel Transylvania 2
460,Animation Family Music,Fantasia 2000
461,Science Fiction Adventure Action,The Time Machine
462,Action Adventure Family Fantasy,Mighty Joe Young
463,Action Crime Thriller,Swordfish
464,Action Adventure,The Legend of Zorro
465,Drama Fantasy Romance,What Dreams May Come
466,Comedy Fantasy Romance,Little Nicky
467,Adventure Fantasy Action Comedy Thriller,The Brothers Grimm
468,Comedy Fantasy Science Fiction,Mars Attacks!
469,Action Adventure Drama,The Edge
470,Action Science Fiction Thriller,Surrogates
471,Drama Thriller,Thirteen Days
472,Action Adventure Thriller,Daylight
473,Animation Family Adventure,Walking With Dinosaurs
474,Action Science Fiction War,Battlefield Earth
475,Animation Comedy Family,Looney Tunes: Back in Action
476,Drama Music Romance,Nine
477,Action Adventure Science Fiction,Timeline
478,Drama Adventure,The Postman
479,Adventure Comedy Drama Family Fantasy,Babe: Pig in the City
480,Fantasy Action Adventure,The Last Witch Hunter
481,Thriller Action Science Fiction,Red Planet
482,Adventure Fantasy Animation Family,Arthur et les Minimoys
483,Documentary Family,Oceans
484,Thriller Science Fiction Adventure Action,A Sound of Thunder
485,Action Adventure History Romance Drama,Pompeii
486,Comedy Animation,Don Gato: El inicio de la pandilla
487,Drama Romance,A Beautiful Mind
488,Family Animation Drama,The Lion King
489,Adventure Action Science Fiction,Journey 2: The Mysterious Island
490,Animation Family Comedy,Cloudy with a Chance of Meatballs 2
491,Crime Thriller Horror,Red Dragon
492,Western Adventure,Hidalgo
493,Comedy,Jack and Jill
494,Action Crime Thriller,2 Fast 2 Furious
495,Adventure Animation Fantasy,The Little Prince
496,Science Fiction Thriller,The Invasion
497,Action Adventure Animation Comedy Family,The Adventures of Rocky & Bullwinkle
498,Animation Family,The Secret Life of Pets
499,Fantasy Action Thriller Science Fiction,The League of Extraordinary Gentlemen
500,Animation Comedy Family,Despicable Me 2
501,Action Adventure Science Fiction,Independence Day
502,Adventure Action Science Fiction,The Lost World: Jurassic Park
503,Family Animation,Madagascar
504,Drama Action Thriller Science Fiction,Children of Men
505,Adventure Action Science Fiction,X-Men
506,Action Thriller Crime,Wanted
507,Action Adventure Thriller,The Rock
508,Animation Family Comedy Adventure,Ice Age: The Meltdown
509,Comedy Romance,50 First Dates
510,Family Comedy Music Romance,Hairspray
